{
  "$schema": "https://json-schema.org/draft/2020-12/schema",
  "$id": "mythos/loop-grade-record/1.0",
  "title": "Mythos Loop Grade Record",
  "description": "Grade record for a Self-Improving Loop Protocol unit (law-candidate invariant 6). A grade authorizes closure of a loop iteration only through the lib-mediated closure gate (tools/planning/lib/loop-grade-record.js#assertClosable). It encodes producer/validator distinct-intelligence provenance, the frozen convergence baseline, the named failure classifier, the threshold, and the tiered distinct-family assertion. Never hand-author a grade record — write it through writeGradeRecord().",
  "type": "object",
  "additionalProperties": true,
  "required": [
    "unit_id",
    "produced_by",
    "validated_by",
    "frozen_baseline_sha",
    "classifier_id",
    "convergence_threshold",
    "verdict",
    "roster_distinct_family",
    "grade_class"
  ],
  "properties": {
    "unit_id": {
      "type": "string",
      "minLength": 1,
      "description": "Identifier of the loop unit (queue item) this grade decides."
    },
    "grade_class": {
      "type": "string",
      "enum": ["draft", "routine", "consequence", "acceptance", "kernel"],
      "description": "Tier of the graded decision. base tier {draft,routine} requires only a distinct actor+harness roster; consequence tier {consequence,acceptance,kernel} additionally requires >=1 validator with a distinct model_family (law inv 6, tiered rule)."
    },
    "produced_by": {
      "$ref": "#/$defs/mind",
      "description": "The mind that PRODUCED the graded work. Must not appear in validated_by."
    },
    "validated_by": {
      "type": "array",
      "minItems": 1,
      "items": { "$ref": "#/$defs/mind" },
      "description": "The distinct minds that VALIDATED the work. Base distinctness = different actor + harness than producer; consequence-grade additionally requires >=1 with a different model_family."
    },
    "frozen_baseline_sha": {
      "type": "string",
      "minLength": 1,
      "pattern": "^[0-9a-fA-F]{7,64}$",
      "description": "SHA of the FROZEN baseline the convergence classifier ran against. Convergence needs a frozen baseline, not a same-family majority (law inv 6)."
    },
    "classifier_id": {
      "type": "string",
      "minLength": 1,
      "description": "Identifier of the named failure classifier used to decide convergence."
    },
    "convergence_threshold": {
      "type": "number",
      "minimum": 0,
      "maximum": 1,
      "description": "Defined numeric convergence threshold (0..1) the classifier score must meet."
    },
    "verdict": {
      "type": "string",
      "enum": ["accept", "reject", "block"],
      "description": "The grade's decision on the unit. Independent of whether the record is CLOSABLE (structurally/roster valid)."
    },
    "roster_distinct_family": {
      "type": "boolean",
      "description": "Claim that the validator roster contains a model_family distinct from the producer. Verified against the actual roster by the closure gate; a false claim is rejected."
    },
    "produced_at": {
      "type": "string",
      "description": "Optional ISO-8601 timestamp of production."
    },
    "classifier_score": {
      "type": "number",
      "description": "Optional recorded classifier score for the unit."
    },
    "objection_ledger_ref": {
      "type": "string",
      "minLength": 1,
      "description": "v3 convergence: reference (loop-instance id) to the adversary-signed open-objection ledger (tools/kernel/loop-protocol/objection-ledger.js). DRY requires this ledger CLEAR (all objections CLOSED)."
    },
    "new_material_objections_count": {
      "type": "integer",
      "minimum": 0,
      "description": "v3 convergence signal (2): count of NEW material objections raised this cycle. A dry cycle requires 0. Absent => treated as NOT-dry (fail-safe)."
    },
    "new_disconfirming_evidence_count": {
      "type": "integer",
      "minimum": 0,
      "description": "v3 convergence signal (2): count of NEW disconfirming evidence items this cycle. A dry cycle requires 0. Absent => NOT-dry (fail-safe)."
    },
    "position_delta": {
      "type": "number",
      "minimum": 0,
      "description": "v3 convergence signal (2): magnitude of position change this cycle. A dry cycle requires position_delta <= convergence_threshold. Absent => NOT-dry (fail-safe)."
    },
    "claim_authors": {
      "type": "array",
      "items": { "$ref": "#/$defs/mind" },
      "description": "v3 non-complicity (3): minds that co-authored the CLAIM/position under review. A validator appearing here is complicit and disqualified as apex."
    },
    "prior_synthesis_participants": {
      "type": "array",
      "items": { "$ref": "#/$defs/mind" },
      "description": "v3 non-complicity (3): minds that participated in prior synthesis of this position. A validator appearing here is complicit and disqualified as apex."
    },
    "non_complicit": {
      "type": "boolean",
      "description": "v3 (3): claim that NO validator is a claim co-author or prior synthesis participant. Verified against claim_authors/prior_synthesis_participants by the convergence gate; a false claim is rejected."
    },
    "operator_complicity_downgrade": {
      "type": "boolean",
      "description": "v3 (3): explicit operator flag permitting closure when complicity provenance (claim_authors/prior_synthesis_participants) is ABSENT. Without it, absent provenance fail-safes to non-complicit=INVALID."
    },
    "anchor": {
      "type": "object",
      "additionalProperties": true,
      "description": "v3 (5): domain-appropriate non-LLM ground-truth anchor. DRY requires passed AND falsifiable AND a countersigner, with anchor selection countersigned. If no falsifiable anchor exists (pure-judgment), CONVERGED is prohibited (route to operator as PROVISIONAL_CONSENSUS).",
      "properties": {
        "passed": { "type": "boolean", "description": "The anchor PASSED for this cycle." },
        "falsifiable": { "type": "boolean", "description": "Countersigned as CAN-FAIL-IF-CLAIM-FALSE. An anchor that cannot fail on the claim does NOT satisfy (5)." },
        "countersigner": { "description": "The adversary/operator who countersigned falsifiability + selection. Non-empty string or a mind object.", "type": ["string", "object"] },
        "selection_countersigned": { "type": "boolean", "description": "Anchor SELECTION is in the countersign set (not coordinator-chosen unwitnessed)." },
        "domain_appropriate": { "type": "boolean", "description": "Adjudicated domain-appropriate by the countersigner (never the coordinator)." }
      }
    },
    "seeded_probe": {
      "type": "object",
      "additionalProperties": true,
      "description": "v3 (4): seeded-flaw calibration probe applied to the apex this cycle. Authorship, selection, insertion, AND grading must ALL be under non-defendant custody (out-of-band or operator, never coordinator). A miss => INVALID_APEX_DEGRADED.",
      "properties": {
        "custody": {
          "type": "object",
          "additionalProperties": true,
          "description": "Custody of each probe stage. Each value must be a non-defendant custodian ('operator' or 'out-of-band').",
          "properties": {
            "authorship": { "type": "string" },
            "selection": { "type": "string" },
            "insertion": { "type": "string" },
            "grading": { "type": "string" }
          }
        },
        "caught": { "type": "boolean", "description": "The apex CAUGHT the seeded flaw (calibration passed)." },
        "passed": { "type": "boolean", "description": "Overall probe verdict PASS for this cycle." },
        "probe_ref": { "type": "string", "description": "Reference into the out-of-band probe fixture library (tools/kernel/loop-protocol/fixtures/calibration-probes/)." }
      }
    },
    "pre_freeze_countersign": {
      "type": "object",
      "additionalProperties": true,
      "description": "v3 (6): content-bearing pre-freeze countersign of classifier/threshold/evidence-query/framing/dedup/anchor-selection by the adversary or operator. Must state the strongest objection to the framing, not merely sign.",
      "properties": {
        "classifier": { "type": "boolean" },
        "threshold": { "type": "boolean" },
        "evidence_query": { "type": "boolean" },
        "framing": { "type": "boolean" },
        "dedup": { "type": "boolean" },
        "anchor_selection": { "type": "boolean" },
        "countersigner": { "type": ["string", "object"], "description": "Adversary/operator who countersigned." },
        "strongest_objection": { "type": "string", "minLength": 1, "description": "REQUIRED non-empty strongest objection to the framing. Empty/absent => countersign not content-bearing => NOT-dry." }
      }
    }
  },
  "$defs": {
    "mind": {
      "type": "object",
      "additionalProperties": true,
      "required": ["actor", "harness", "model_family"],
      "properties": {
        "actor": {
          "type": "string",
          "minLength": 1,
          "description": "Actor identity (e.g. claude-opus, codex, gemini-pro)."
        },
        "harness": {
          "type": "string",
          "minLength": 1,
          "description": "Harness the actor ran under (e.g. claude-code, codex-cli, gemini-cli)."
        },
        "model_family": {
          "type": "string",
          "minLength": 1,
          "description": "Model family (e.g. claude, gpt, gemini). Consequence-grade distinctness is decided on this field."
        }
      }
    }
  }
}
